{
  "gate_id": "persona-qa",
  "task_id": "TASK-TODO-001",
  "agent": "persona-scenario-qa-agent",
  "timestamp": "2026-05-11T12:00:00Z",
  "status": "pass",
  "inputs_checked": ["persona QA report", "acceptance criteria"],
  "commands_run": [],
  "findings": ["First-time user scenario maps to local add, complete, and delete behavior."],
  "routing_decision": "proceed_to_state_checkpoint"
}
